{
  "schema_version": 1,
  "conversation_id": "fixture-conversation",
  "event_id": "fixture-event-invalid-url",
  "run_id": "fixture-run",
  "phase_id": "phase-1",
  "wave_id": 1,
  "kind": "waiting_user",
  "notification_type": "attention",
  "waiting_reason": "USER_SCOPE",
  "correlation_id": "corr-1",
  "problem_title": "Unavailable verdict link",
  "summary": "This fixture must be rejected because a URL is present while the verdict is unavailable.",
  "full_verdict_available": false,
  "full_verdict_url": "https://example.invalid/verdict"
}
